<?xml version="1.0"?>
<!DOCTYPE JavaXML:Book SYSTEM "JavaXML.dtd">

<!-- Java and XML -->
<JavaXML:Book xmlns:JavaXML="http://www.oreilly.com/catalog/javaxml/">
 <JavaXML:Title>Java and XML</JavaXML:Title>
 <JavaXML:Contents>

  <JavaXML:Chapter focus="XML">
   <JavaXML:Heading>Introduction</JavaXML:Heading>
   <JavaXML:Topic subSections="7">What Is It?</JavaXML:Topic>
   <JavaXML:Topic subSections="3">How Do I Use It?</JavaXML:Topic>
   <JavaXML:Topic subSections="4">Why Should I Use It?</JavaXML:Topic>
   <JavaXML:Topic subSections="0">What's Next?</JavaXML:Topic>
  </JavaXML:Chapter>

  <JavaXML:Chapter focus="XML">
   <JavaXML:Heading>Creating XML</JavaXML:Heading>
   <JavaXML:Topic subSections="0">An XML Document</JavaXML:Topic>
   <JavaXML:Topic subSections="2">The Header</JavaXML:Topic>
   <JavaXML:Topic subSections="6">The Content</JavaXML:Topic>
   <JavaXML:Topic subSections="1">What's Next?</JavaXML:Topic>
  </JavaXML:Chapter>

  <JavaXML:Chapter focus="Java">
   <JavaXML:Heading>Parsing XML</JavaXML:Heading>
   <JavaXML:Topic subSections="3">Getting Prepared</JavaXML:Topic>
   <JavaXML:Topic subSections="3">SAX Readers</JavaXML:Topic>
   <JavaXML:Topic subSections="9">Content Handlers</JavaXML:Topic>
   <JavaXML:Topic subSections="4">Error Handlers</JavaXML:Topic>
   <JavaXML:Topic subSections="0">
     A Better Way to Load a Parser
   </JavaXML:Topic>
   <JavaXML:Topic subSections="4">"Gotcha!"</JavaXML:Topic>
   <JavaXML:Topic subSections="0">What's Next?</JavaXML:Topic>
  </JavaXML:Chapter>

  <JavaXML:SectionBreak/>

  <JavaXML:Chapter focus="Java">
   <JavaXML:Heading>Web Publishing Frameworks</JavaXML:Heading>
   <JavaXML:Topic subSections="4">Selecting a Framework</JavaXML:Topic>
   <JavaXML:Topic subSections="4">Installation</JavaXML:Topic>
   <JavaXML:Topic subSections="3">
     Using a Publishing Framework
   </JavaXML:Topic>
   <JavaXML:Topic subSections="2">XSP</JavaXML:Topic>
   <JavaXML:Topic subSections="3">Cocoon 2.0 and Beyond</JavaXML:Topic>
   <JavaXML:Topic subSections="0">What's Next?</JavaXML:Topic>
  </JavaXML:Chapter>

 </JavaXML:Contents>

 <JavaXML:Copyright>&OReillyCopyright;</JavaXML:Copyright>

</JavaXML:Book>